question,note,optionD,optionC,optionB,mark,count,optionF,questionid,subject,optionE,year,type,optionA,paperName,answer
工作面倾角在（）°以上时，配套的刮板输送机必须装设防滑、锚固装置。,,,15,12,0,,,2696,,,2017,单选题,10,2017B500,B
突出煤层的采掘工作面，有瓦斯喷出危险的采掘工作面和瓦斯涌出较大、变化异常的采掘工作面，瓦斯浓度检查次数()。,,必须有专人经常检查,每班至少4次,每班至少3次,0,,,2732,,,2017,单选题,每班至少2次,2017B500,D
重大危险源分为生产场所重大危险源和贮存区重大危险源两种。,,,,,0,2,,1472,,,2012,判断题,,应急管理,y
突出与冲击地压煤层在长距离的掘进巷道中，每组压风自救装置应当可供（）使用，平均每人空气供给量不得少于0.1m3/min。,,10～15人,8～10人,5～8人,0,1,,2580,,,2017,单选题,3～5人,2017B500,B
《安全生产法》适用于中华人民共和国领域内从事生产经营活动的单位，因此，自然适用于香港和澳门两个特别行政区。,,,,,0,,,1720,,,2016,判断题,,2016B500,n
启封火区时，应逐段恢复通风，同时测定回风流中有无一氧化碳。,,,,,0,,,1281,,,2012,判断题,,一通三防,y
采取了防护措施后，可以在防隔水煤柱中采掘。,,,,,0,,,1042,,,2012,判断题,,地质安全,n
新建矿井揭露的水文地质条件比地质报告复杂的，应当进行水文地质补充勘探，及时查明水害隐患，采取可靠的安全防范措施。井下探放水应当采用专用钻机、由专业人员和专职探放水队伍进行施工。,,,,,0,,,1101,,,2012,判断题,,地质安全,y
《煤矿隐患排查和整顿关闭实施办法<试行>》规定：对决定关闭的煤矿，由有关地方人民政府立即组织实施，责令煤矿企业(        )。,,恢复地貌,平整井口场地,封闭、填实矿井井筒,0,,,611,,,2012,多选题,拆除矿井生产设备和通信设施,法律法规,ABCD
在有煤与瓦斯突出危险的煤层中，可以用放顶煤采煤法。,,,,,0,,,1190,,,2012,判断题,,开采安全,n
建立安全生产责任制能够明确生产经营单位中各级负责人员、各职能部门及其工作人员和各岗位生产人员在安全生产中应履行的职责和应承担的责任。,,,,,0,,,980,,,2012,判断题,,安全管理,y
《煤矿领导带班下井及安全监督检查规定》所称煤矿领导，是指煤矿的(        )。,,副总工程师,领导班子成员,主要负责人助理,0,,,920,,,2012,多选题,主要负责人,安全管理,ACD
《煤矿领导带班下井及安全监督检查规定》第十八条规定：煤矿有下列(        )情形之一的，给予警告，并处3万元罚款。,,来按规定填写煤矿领导下井交接班记录簿、带班下井记录或者保存带班下井相关记录档案的,煤矿领导每月带班下井情况未按照规定公示的,未建立煤矿领导井下交接班制度的或未建立煤矿领导带班下井档案管理制度的,0,1,,856,,,2012,多选题,未建立健全煤矿领导带班下井制度，或者未按规定报煤炭行业管理部门备案和抄送煤矿安全监管部门、煤矿安全监察机构的,安全管理,ABCD
依据《安全生产法》，事故调查处理应当按照实事求是、尊重科学的原则，及时、准确地查清事故的原因。,,,,,0,2,,1746,,,2016,判断题,,2016B500,n
“超能力、超强度或者超定员组织生产”是指有下列(        )情形之一。,,一个采区内同一煤层布置3个(含3个)以上回采工作面或5个(含5个)以上掘进工作面同时作业,矿井月产量超过当月产量计划10％,矿井全年产量超过矿井核定生产能力,0,3,,743,,,2012,多选题,矿井全年产量达到矿井核定生产能力,法律法规,BCD
《山西省煤矿安全质量标准化标准》中通风专业标准要求采用局部通风机供风的巷道应实现(        )，具备相互独立的两回路电源。,,“三专两闭锁”,“三开一防”,“五通一平”,1,,,2195,,,2016,单选题,“三同时”,2016B500,D
发生在上行风流中的火灾，产生的火风压会使火源所在巷道风量(        )。,,,不变,减小,0,,,515,,,2012,单选题,增加,应急管理,A
紧急避险设施的（）应满足服务区域所有人员紧急避险需要。,,类型,位置,容量,1,,,2772,,,2017,多选题,数量,2017B500,"A,B,C"
《山西省人民政府安全生产委员会关于印发进一步加强煤矿瓦斯防治的八项规定的通知》规定：加强从业人员培训管理，开展“(        )”安全知识培训，提高员工辨识瓦斯隐患的能力、处置瓦斯隐患的能力、避灾脱险的能力及防范事故的能力。,,,人人都是监督员,人人都是通风员,0,,,2170,,,2016,单选题,人人都是班组长,2016B500,B
携带爆炸材料上、下井时，在每层罐笼内搭乘的携带爆炸材料的人员不得超过(        )人，其他人员不得同罐上下。,,,5,4,0,,,124,,,2012,单选题,2,爆破安全,B
《煤矿安全规程》第四十五条规定：在揭露老空时，只有经过检查，(        )，方可恢复工作。,,,进行瓦斯抽放后,证明老空内的水、瓦斯和其他有害气体等无危险后,0,,,335,,,2012,单选题,将人员撤至安全地点,开采安全,B
国家对煤矿企业实行安全生产许可制度。煤矿企业未取得安全生产许可证的，不得从事生产活动。,,,,,0,,,1554,,,2012,判断题,,法律法规,y
煤矿企业每年必须至少组织(        )次矿井救灾演习。,,,3,2,0,,,49,,,2012,单选题,1,安全管理,A
对于煤层顶、底板带压的采掘工作面，应当提前编制防治水设计，制定并落实水害防治措施。?（）,,,,,0,,,2419,,,2017,判断题,,2017B500,y
采用轨道机车运输的巷道净高，自轨面起不得低于2m。架线电机车巷道从井底到乘车场，不得小于2.2m，其他地点行人的不小于2m，不行人的不小于1.9m。,,,,,0,,,2460,,,2017,判断题,,2017B500,n
《安全生产法》规定，给予(        )的行政处罚由公安机关依照治安管理处罚条例的规定决定。,,吊销执照,罚款,拘留,0,2,,2141,,,2016,单选题,关闭,2016B500,B
井下电气设备的局部接地极可设置于电气设备就近潮湿处。,,,,,0,,,1421,,,2012,判断题,,机电运输,y
《煤矿安全监察条例》规定：煤矿发生事故后，阻碍、干涉事故调查工作，拒绝接受调查取证、提供有关资料和情况的，给予警告，可以并处3万元以上15万元以下的罚款，情节严重的，责令(        )。,,,停产整顿,限期改正,0,,,296,,,2012,单选题,关闭,法律法规,C
煤矿企业安全检查必须由本企业的(        )亲自组织。,,,安全管理部,分管安全领导,0,1,,535,,,2012,单选题,主要负责人,安全管理,A
带式输送机运转中，发生断带事故的主要原因是(        )，,,输送带磨损超限、老化,输送带接头质量不符合要求,严重超载,0,,,823,,,2012,多选题,输送带张力过大,机电运输,ABCD
"突出矿井必须建设采区避难硐室,必须接入矿井（）,满足避险人员的避险需要。",,通信线路,供电线路,供水管路,0,1,,2767,,,2017,多选题,压风管路,2017B500,"A,B"
井下电气设备保护接地的主接地极应在(        )各埋设1块。,,,水沟、潮湿处,主、副水仓中,0,,,424,,,2012,单选题,水仓、水沟中,机电运输,B
对因瓦斯浓度超限被切断电源的电气设备，必须在瓦斯浓度降到(        )％以下时，方可通电开动。,,,1,0.75,0,1,,32,,,2012,单选题,0.5,一通三防,C
根据《矿山安全法》之规定，作为矿长，必须经过考核，(        )。,,具有处理矿山事故的能力,具有领导安全生产的能力,具备市场经济知识,0,,,730,,,2012,多选题,具备安全专业知识,法律法规,ACD
掘进机停止工作和检修以及交班时，必须做到(        )。,,发出警报,断开磁力启动器的隔离开关,断开掘进机电源开关,0,,,710,,,2012,多选题,将掘进机切割头落地,机电运输,ABC
安全生产许可证颁发管理机关在监督检查中，发现企业不再具备本条例规定的安全生产条件的，必须及时予以处理。处理的方式有(        )。,,注销企业的安全丰产许可证,吊销企业的安全生产许可证,，没收企业的安全生产许可证,0,,,897,,,2012,多选题,暂扣企业的安全生产许可证,法律法规,AC
发生煤与瓦斯突出事故后，应该(        )。,,,保持或立即恢复正常通风,反风,0,,,439,,,2012,单选题,停风,应急管理,C
主要排水泵房的（）必须经常检查和维护。,,闸阀,配电设备,水管,0,,,2834,,,2017,多选题,水泵,2017B500,"A,B,C,D"
设置生产管理机构，配备生产管理人员，是企业取得安全生产许可证必须具备的安全生产条件之一。,,,,,0,,,1559,,,2012,判断题,,法律法规,n
矿山建设项目竣工投入生产或者使用前，必须依照有关法律、行政法规的规定对安全设施进行验收，施工单位对验收结果负责。,,,,,0,,,1536,,,2012,判断题,,法律法规,n
下列属于减尘措施的是(        )。,,,煤层注水,放炮喷雾,0,2,,544,,,2012,单选题,转载点喷水降尘,一通三防,C
新建矿井应当对井田范围内采掘工程可能揭露的所有平均厚度在()以上的煤层进行突出危险性评估，评估结果作为矿井初步设计和建井期间井巷揭煤作业的依据。,,0.5m,0.4m,0.3m,0,,,2754,,,2017,单选题,0.2m,2017B500,B
煤矿为了逃避应当承担的事故赔偿责任，在劳动合同中与从业人员订立“生死合同”是非法的，无效的，不受法律保护。,,,,,0,,,1777,,,2016,判断题,,2016B500,y
煤矿企业应当设置(        )。,,,安全生产监督机构和安全生产监督人员,安全生产管理机构或者配备专职安全生产管理人员,0,,,203,,,2012,单选题,安全监察机构和安全监察人员,安全管理,B
应急救援的基本任务是(        ),,查清事故原因，评估危害程度,清除事故现场危害后果,及时控制危险源,0,,,693,,,2012,多选题,及时营救遇难人员,应急管理,ABCD
“三同时”是指安全设施与主体工程同时设计、同时施工、(        )。,,,同时检修,同时结算,0,1,,442,,,2012,单选题,同时投入生产和使用,安全管理,A
有人触电导致呼吸停止、心脏停跳，此时在场人员应(        )。,,,立即打急救电话，等待急救人员赶到,迅速做心肺复苏,0,,,472,,,2012,单选题,迅速将伤员送往医院,应急管理,B
用带状充填法控制顶板时，必须在垒砌石垛带之前清扫底板上的浮煤，石砌带必须砌接到顶。,,,,,0,,,1146,,,2012,判断题,,开采安全,y
对小腿动脉出血，止血带的部位应在(        )处。,,,大腿上1／3,大腿中1／3,0,,,243,,,2012,单选题,大腿中下1／3,应急管理,A
《国务院办公厅关于进一步加强煤矿安全生产工作的意见》[国办发〔2013〕99号]要求强制查明隐蔽致灾因素。煤矿企业要加强建设、生产期间的(        )，查明井田范围内的瓦斯、水、火等隐蔽致灾因素，未查明的必须综合运用物探、钻探等勘查技术进行补充勘查；否则，一律不得继续建设和生产。,,,安全检查,地质勘查,0,,,2176,,,2016,单选题,隐患排查,2016B500,B
《山西省人民政府安全生产委员会关于印发进一步加强煤矿瓦斯防治的八项规定的通知》规定：按突出管理的矿井自鉴定<认定>之日起(        )内未完成突出煤层鉴定的，煤矿企业要立即认定为突出矿井。,,,一年,三个月,0,,,2219,,,2016,单选题,A半年,2016B500,A
炸药可以存放在井口房内一段时间。,,,,,0,,,1324,,,2012,判断题,,爆破安全,n
低压检漏装置运行期间，每天需要检查和试验的项目包括(        )。,,调节补偿效果,跳闸试验,欧姆表的指示数值,0,,,725,,,2012,多选题,局部接地极和辅助接地极的安设情况,机电运输,ABC
工作面内排头支架与巷道支护间距不应大于 (        )。,,,03m,05m,0,,,2243,,,2016,单选题,1m,2016B500,B
采掘工作面及其他作业地点风流中瓦斯浓度达到(        )％时，必须停止用电钻打眼,,,1,0.75,0,,,31,,,2012,单选题,0.5,一通三防,C
依据《安全生产法》，县级以上地方人民政府应组织有关部门制定本行政区域内特大生产安全事故应急救援预案，建立应急救援体系。,,,,,0,2,,1771,,,2016,判断题,,2016B500,n
工作面倾角大于15°时，液压支架必须采取防倒、防滑措施;倾角大于()°时，必须有防止煤(矸)窜出刮板输送机伤人的措施。,,33,30,28,1,,,2598,,,2017,单选题,25,2017B500,A
有关协会组织依照法律、行政法规和章程，为生产经营单位提供安全生产方面的信息、培训等服务，发挥自律作用，促进生产经营单位加强安全生产管理。,,,,,0,,,1725,,,2016,判断题,,2016B500,y
"使用掘进机、掘锚一体机、连续采煤机掘进时,应当使用内、外喷雾装置,内喷雾装置的工作压力不得小于（）MPa,外喷雾装置的工作压力不得小于（）MPa。",,4,3,2,0,4,,2836,,,2017,多选题,1.5,2017B500,"B,D"
滚筒驱动的带式输送机可以不使用阻燃输送带。（）,必须使用阻燃输送带,,,,0,,,2476,,,2017,判断题,,2017B500,n
对(        )损伤的伤员，不能用一人抬头、一人抱腿或人背的方法搬运。,,,头部,脊柱,0,,,385,,,2012,单选题,面部,应急管理,B
煤矿井下作业场所常见职业病危害因素有(        ).,,不良气象条件和放射性物质,噪声和振动,有害气体,0,1,,649,,,2012,多选题,粉尘,职业防护,ABCD
《安全生产法》第十八条规定，生产经营单位的主要负责人对本单位安全生产工作负有七个方面的职责，其中最重要的一条是(        )。,,组织制定并实施本单位安全生产教育和培训计划,及时如实报告生产安全事故,建立健全本单位安全生产责任制,0,,,2162,,,2016,单选题,保证安全生产投入的有效实施,2016B500,B
根据《安全生产法》的规定和要求，从业人员有义务(        )。,,增强事故预防和应急处理能力,提高安全生产技能,掌握本职工作所需的安全生产知识,0,1,,717,,,2012,多选题,接受安全生产教育和培训,法律法规,ABCD
井巷中采用钢丝绳牵引带式输送机运送人员时，运行速度不得超过(        )m／s。,,,1.8,1.5,0,,,102,,,2012,单选题,1.2,机电运输,C
发生火灾或爆炸事故后，遇险人员在撤退有困难时应在现场指挥的带领下，可以迅速转入独头巷道，关闭局部通风机，或者切断风筒堵住人口。,,,,,0,3,,1461,,,2012,判断题,,应急管理,n
爆破工接到起爆命令后，必须先发出爆破警号，至少再等(        )S，方可起爆。,,,15,10,0,,,168,,,2012,单选题,5,爆破安全,A
《煤矿领导带班下井及安全监督检查规定》要求煤矿领导带班下井时，应当履行哪些职责？(        ) ,,,遇到险情时，立即下达停产撤人命令，组织涉险区域人员及时有序撤离到安全地点,及时发现和组织消除事故隐患和险情，及时制止违章违纪行为，严禁违章指挥，严禁超能力组织生产,1,3,,2334,,"  ",2016,多选题,加强对重点部位关键环节的检查巡视，全面掌握当班井下的安全生产状况,2016B500,A，B，C
采煤工作面的推进方式一般采用前进式。,,,,,0,,,1180,,,2012,判断题,,开采安全,n
安全检查要(        ),,查隐患,查管理,查制度,1,2,,610,,,2012,多选题,查思想,安全管理,ABCD
锚杆钻车作业时必须有防护操作台，支护作业时必须将临时支护顶棚升至顶板，班组长可以在锚杆钻车周围停留或作业。,,,,,0,,,2558,,,2017,判断题,,2017B500,n
断盘是指断层面两侧相对位移的岩体，位于断层面上方的岩体为(        )。,,,上升盘,上盘,0,,,254,,,2012,单选题,顶盘,地质安全,B
专项应急预案应当包括危险性分析、可能发生的事故特征、应急处置程序、应急处置要点和注意事项等内容。,,,,,0,,,1020,,,2012,判断题,,安全管理,n
《国务院关于预防煤矿生产安全事故的特别规定》规定：关闭煤矿应当达到的要求包括(        )。,,妥善遣散从业人员,封闭、填实矿井井筒，平整井口场地，恢复地貌,停止车辆通行,0,2,,839,,,2012,多选题,停止一切物资供应,法律法规,CD
井下爆炸材料库的最大贮存量，不得超过该矿井3天的炸药需要量和(        )天的电雷管需要量。,,,3,5,0,1,,93,,,2012,单选题,10,爆破安全,A
“三量”是指(        )。,,掘进煤量,准备煤量,回采煤量,1,2,,736,,,2012,多选题,开拓煤量,开采安全,ABC
电气设备着火时，应首先切断电源；在切断电源前，只准使用不导电的灭火器材进行灭火。,,,,,0,,,1270,,,2012,判断题,,一通三防,y
《山西省煤矿安全质量标准化标准》中通风专业标准要求瓦斯检查工应持证上岗，瓦斯检查要做到井下记录牌、瓦检手册、(        )“三对口”。,,,瓦斯调度台账,人员调度台账,0,,,2217,,,2016,单选题,瓦检设备,2016B500,C
建设项目安全设施的设计人、设计单位应当对安全设施设计负责。,,,,,0,,,1534,,,2012,判断题,,法律法规,y
《煤矿安全规程》第四十七条规定：由下向上掘进25°以上的倾斜巷道时，必须将溜煤<矸>道与(        )分开。,,,轨道,人行道,0,,,409,,,2012,单选题,绕道,开采安全,B
关于对烧伤人员的急救正确的是(        ),,用较干净的衣服把伤面包裹起来，防止感染，并把严重伤员尽快送往医院；搬运时，动作要轻、稳,防止休克、窒息、疮面污染,立即检查伤员伤情，检查呼吸、心跳,0,,,877,,,2012,多选题,迅速扑灭伤员身上的火，尽快脱离火源，缩短烧伤时间,应急管理,ABCD
根据《煤矿重大安全生产隐患认定办法<试行>》之规定，有冲击地压危险的矿井配备专业人员并编制专门设计，属于煤矿重大安全生产隐患。,,,,,0,1,,1624,,,2012,判断题,,法律法规,n
矿井掘进工作面正常工作的局部通风机必须配备同等能力的备用局部通风机，并能自动切换。正常工作的局部通风机必须采用“三专”供电。,,,,,0,,,2039,,,2016,判断题,,2016B500,y
开采有瓦斯喷出或有煤<岩>与瓦斯<二氧化碳>突出危险的煤层时，两个工作面之间可以串联通风。,,,,,0,,,1252,,,2012,判断题,,一通三防,n
下列能影响尘肺病发生的有(        ),,身体强弱,接触矿尘时间,粉尘浓度,0,6,,650,,,2012,多选题,粉尘成分,一通三防,ABCD
以下对国家安全监管总局提出的煤矿长周期“零死亡”四最要求表述正确的是：(        )。,,党政领导要把追求“零死亡”作为最过硬的业绩,矿工要做自己生命的主人，把追求“零死亡”作为最强烈的意识和自觉行为,矿长要把保护矿工生命安全追求“零死亡”作为最神圣的职责,0,1,,2329,,"  ",2016,多选题,煤矿要把追求“零死亡”作为最过硬的业绩,2016B500,B，C，D
《煤矿安全规程》规定：在坚硬和稳定的煤、岩层中，确定巷道不设支护时，必须制定(        )措施。,,,技术,安全,0,,,304,,,2012,单选题,过渡,开采安全,B
在掘进工作面应全断面一次起爆，不能全断面一次起爆的必须采取安全措施。,,,,,0,2,,1296,,,2012,判断题,,爆破安全,y
只有在局部通风机及其开关附近(        )m以内风流中的瓦斯浓度都不超过0.5％时，方可人工开启局部通风机。,,,15,10,0,,,167,,,2012,单选题,5,一通三防,B
入井人员必须随身携带自救器、标识卡和矿灯，严禁携带烟草和点火物品，可以穿化纤衣服。,严禁穿化纤衣服,,,,0,,,2387,,,2017,判断题,,2017B500,n
未取得煤炭生产许可证，擅自从事煤炭生产的，由煤炭管理部门责令停止生产，没收违法所得，可以并处违法所得一倍以上五倍以下罚款；拒不停止生产的，由县级以上地方人民政府强行停产。,,,,,0,,,1532,,,2012,判断题,,法律法规,y
采煤工作面采用倒悬臂支架主要是为了支护采煤机机道上方顶板。,,,,,0,,,1155,,,2012,判断题,,开采安全,n
"“超层越界开采”,是指有下列（）情形之一。",,擅自开采保安煤柱,超出采矿许可证载明的坐标控制范围开采,超出采矿许可证规定开采煤层层位进行开采,0,,,2796,,,2017,多选题,工作面煤层回采率超过90%,2017B500,"B,C,D"
修订后的《煤矿安全规程》已经2015年()国家安全生产监督管理总局第13次局长办公会议审议通过。,,12月31日,10月31日,12月22日,1,,,2584,,,2017,单选题,10月22日,2017B500,B
有冲击地压的矿井应该制定具有针对性的专项预案。,,,,,0,2,,1448,,,2012,判断题,,应急管理,y
从业人员接受安全生产教育和培训的目的是(        )。,,掌握安全生产知识,增强事故预防能力,服从管理,0,,,2281,,增强事故应急处理能力,2016,多选题,提高安全生产技能,2016B500,A，C，D，E
煤矿对重大危险源应当登记建档，进行定期检测、评估、监控，并制定(        )，告知从业人员和相关人员在紧急情况下应当采取的应急措施。,,,应急预案,管理制度,0,,,502,,,2012,单选题,预防办法,法律法规,C
所有爆破人员，包括(        )、装药人员，必须熟悉爆炸材料性能和本规程规定。,,护送人员,送药人员,爆破人员,0,1,,582,,,2012,多选题,班<组>长,爆破安全,BC
下列属于矿井下防治水措施的有(        ).,,建设防水闸门和防水闸墙,含水层的疏放降压,井下探放水,0,,,761,,,2012,多选题,留设防隔水煤<岩>柱,地质安全,ABCD
煤矿企业必须加强安全生产管理，建立健全各级负责人、各部门、各岗位安全生产与职业病危害防治责任制。,,,,,0,,,2390,,,2017,判断题,,2017B500,y
柴油机单轨吊车运行巷道坡度不大于（）°，蓄电池单轨吊车不大于15°，钢丝绳单轨吊车不大于25°。,,,25,20,0,,,2672,,,2017,单选题,15,2017B500,C
开采底板有承压含水层的煤层，应当保证隔水层能够承受的水头值大于实际水头值，制定专项安全技术措施。专项安全技术措施由煤矿企业主要负责人审查，报煤矿企业技术负责人审批。,,,,,0,,,1026,,,2012,判断题,,安全管理,n
《煤矿安全规程》第八十一条规定：防治冲击地压的措施中，必须规定发生冲击地压时的(        )。,,,急救措施，,作业方法,0,,,239,,,2012,单选题,撤人路线,开采安全,A
开动掘进机前，必须做到(        )时，才可开动掘进机。,,截割臂附近无人,铲板前方无人,发出警报,0,,,890,,,2012,多选题,有专人放哨,机电运输,BCD
根据《安全生产法》的规定，股份有限公司安全投入的保障主体是(        )。,,执行总裁,监事会,股东大会,0,,,2144,,,2016,单选题,董事会,2016B500,A
《煤矿安全规程》第五十五条规定：采煤工作面开工前，班组长必须对工作面安全情况进行(        )，确认无危险后，方准人员进入工作面。,,,一般检查,重点检查,0,,,405,,,2012,单选题,全面检查,开采安全,A
煤矿1个月内3次或者3次以上未依照国家有关规定对井下作业人员进行安全生产教育和培训或者特种作业人员无证上岗的，负责煤矿有关证照颁发的部门应当责令该煤矿立即停止生产，并提请县级以上地方人民政府予以关闭。,,,,,0,,,1664,,,2012,判断题,,法律法规,y
"各种车辆的两端必须装置碰头,每端突出的长度不得小于（）.",,,200mm,150mm,0,,,2663,,,2017,单选题,100mm,2017B500,A
任何单位和个人可以依法对事故的调出处理提出质疑。,,,,,0,,,1748,,,2016,判断题,,2016B500,n
排除井筒和下山的积水及恢复被淹井巷前，应当制定可靠的安全措施，防止被水封住的有毒、有害气体突然涌出。,,,,,0,,,1065,,,2012,判断题,,地质安全,y
发生透水事故时，应沿来上班的路线撤退。,,,,,0,,,1083,,,2012,判断题,,地质安全,n
《煤矿安全规程》规定：粉尘监测的项目是(        ),,粉尘分散度,粉尘中游离二氧化硅含量,呼吸性粉尘浓度,0,,,931,,,2012,多选题,作业场所的粉尘浓度,职业防护,ABCD
每一提升装置，必须装有从井底信号工发给井口信号工和从井口信号工发给绞车司机的信号装置。,,,,,0,,,1434,,,2012,判断题,,机电运输,y
使用的矿用防爆型柴油动力装置，排气口的排气温度不得超过77℃，其表面温度不得超过150℃。冷却水温度不超过95℃。,,,,,0,,,2463,,,2017,判断题,,2017B500,y
"使用的单轨吊车、卡轨车、齿轨车、胶套轮车、无极绳连续牵引车,在最大载荷最大坡度上以最大设计速度向下运行时，制动距离应不超过相当于在这一速度下()的行程。",,,6s,5s,0,,,2652,,,2017,单选题,4s,2017B500,C
煤矿发生1起较大生产安全责任事故或者1年内发生(        )起一般生产安全责任事故的，考核发证部门有权责令负有事故责任的矿长和安全生产管理人员参加复训；经复训考核合格的，方可重新上岗；经复训考核不合格的，应当暂停或者撤销其安全资格证和矿长资格证。,,,4,3,0,,,118,,,2012,单选题,2,法律法规,A
根据《煤矿重大安全生产隐患认定办法<试行>》之规定，超出采矿许可证载明的坐标控制范围开采的，属于煤矿重大安全生产隐患。,,,,,0,,,1622,,,2012,判断题,,法律法规,y
