question,note,optionD,optionC,optionB,mark,count,optionF,questionid,subject,optionE,year,type,optionA,paperName,answer
井下发生火灾时，在抢救人员和灭火过程中，必须指定专人检查瓦斯、一氧化碳、煤尘、其他有害气体和风向、风量的变化，还必须采取防止瓦斯、煤尘爆炸和人员中毒的安全措施。,,,,,0,,,1488,,,2012,判断题,,应急管理,y
《煤矿重大安全生产隐患认定办法<试行>》中“煤矿实行整体承包生产经营后，未重新取得煤炭生产许可证和安全生产许可证，从事生产的，或者承包方再次转包的，以及煤矿将井下采掘工作面和井巷维修作业进行劳务承包”，是指有下列(        )情形之一。,,承包方(承托方)未重新取得煤炭生产许可证和安全生产许可证进行生产,煤矿(矿井)实行承包(托管)但未签订载有双方安全责任与权力内容的承包合同进行生产,煤矿(矿井)实行承包(托管)但未签订安全生产管理协议进行生产,0,,,813,,,2012,多选题,生产经营单位将煤矿(矿井)承包或者出租给不具备安全生产条件或者相应资质的单位或者个人,法律法规,ABCD
煤矿企业必须对安全设备进行经常性维护、保养，并定期检测，保证正常运转。,,,,,0,,,1769,,,2016,判断题,,2016B500,y
采掘工作面接近水淹或者可能积水的井巷、老空区或者相邻煤矿时，应边掘边探。（）,,,,,0,,,2432,,,2017,判断题,,2017B500,n
一个掘进工作面，使用2台局部通风机通风，这2台局部通风机都必须同时实现风电闭锁。,,,,,0,,,1264,,,2012,判断题,,一通三防,y
根据“(        )”的原则，我国的相关法律法规明确规定了安全生产领导和各类业务人员在生产业务活动中应负的安全责任。,,,合理行政,依法行政,0,,,301,,,2012,单选题,管生产必须管安全,法律法规,A
通常向斜构造比背斜构造对瓦斯保存有利。,,,,,0,2,,1077,,,2012,判断题,,地质安全,y
矿井井下排水设备，工作水泵和备用水泵的总能力，应能在20h内排出矿井24h的最大涌水量。,,,,,0,,,1349,,,2012,判断题,,机电运输,y
生产经营单位的从业人员有权(        ),,拒绝违章指挥和强令冒险作业,对本单位安全生产工作中存在的问题提出批评、检举、控告,对本单位的安全生产工作提出建议,1,3,,750,,,2012,多选题,了解其作业场所和工作岗位存在的危险因素、防范措施及事故应急措施,法律法规,ABCD
对发生事故而没有煤矿领导带班下井的煤矿，对其主要负责人依法暂扣或者吊销其安全资格证和矿长资格证，并依照《煤矿领导带班下井及安全监督检查规定》进行罚款。,,,,,0,,,1682,,,2012,判断题,,法律法规,y
《煤矿重大安全生产隐患认定办法<试行>》适用于各类煤矿重大安全生产隐患的认定。,,,,,0,,,1601,,,2012,判断题,,法律法规,y
对使用中的斜井人车防坠器，每年必须进行一次重载全速脱钩试验。,,,,,0,,,1362,,,2012,判断题,,机电运输,y
用人单位应当按照规定，在必要时对工作场所进行职业病危害因素检测评价。,,,,,0,,,1490,,,2012,判断题,,职业防护,n
下列哪种物质不能降低瓦斯的爆炸下限浓度(        )。,,,惰性气体,煤尘,0,1,,400,,,2012,单选题,氢气,一通三防,C
掘进巷道在揭露老空区前，必须制定探查老空区的安全措施，包括接近老空时必须预留的煤岩柱厚度和探明水、火、瓦斯等内容，必须根据探明的情况采取措施，进行处理。,,,,,0,,,2545,,,2017,判断题,,2017B500,y
承压水具有随深度增加，其水压、水量减小的特征。,,,,,0,,,1086,,,2012,判断题,,地质安全,n
采用综合机械化采煤时，液压支架必须接顶。顶板破碎时，必须超前支护.,,,,,1,,,1143,,,2012,判断题,,开采安全,y
井下低压配电点或装有()台以上电气设备的地点，应装设局部接地极。,,,5,4,0,,,2711,,,2017,单选题,3,2017B500,A
"DKL生命探测仪长距离侦测杆距离可达500m,短距离侦测杆距离30 m。",错误原因：30，正确为：20,,,,0,,,2051,,,2016,判断题,,2016B500,n
煤矿发生生产安全事故，经事故调查认定为突出事故的，发生事故的煤层()为突出煤层，该矿井为突出矿井。,,间接认定,直接认定,可以认定,0,1,,2751,,,2017,单选题,经鉴定后认定,2017B500,C
矿用橡套电缆的接地芯线，除用作监测接地回路外，不得兼作他用。,,,,,0,,,1422,,,2012,判断题,,机电运输,y
综采工作面的局部冒顶，主要是发生在靠近煤壁附近的漏冒型冒顶。,,,,,1,,,1164,,,2012,判断题,,开采安全,y
通风值班人员必须审阅瓦斯班报，掌握瓦斯变化情况，发现问题，及时处理，并向()汇报。,,矿调度室,通风科长,通风矿长,0,,,2737,,,2017,单选题,矿长,2017B500,D
依据《安全生产法》的规定，特种作业人员的范围由(        )确定。,,国务院负责安全生产监督管理的部门或者国务院有关部门,国务院负责安全生产监督管理的部门会同国务院有关部门,国务院安全生产监督管理部门会同国务院有关部门,0,,,2140,,,2016,单选题,国务院负责安全生产监督管理的部门,2016B500,B
《山西省煤矿建设标准》要求井工矿井下排水设备的备用排水泵的能力不应小于工作水泵能力的(        )。,,80%,70%,60%,0,,,2190,,,2016,单选题,50%,2016B500,C
矿井主要水仓的空仓容量应当经常保持在总容量的（）以上。,,,60%,50%,0,,,2692,,,2017,单选题,30%,2017B500,B
下列说法中，错误的是(        )。,,,外壳内随意增加元件使电气距离小于规定值造成失爆,隔爆接合面严重锈蚀为失爆，可涂油漆防锈,0,,,449,,,2012,单选题,外壳严重变形或出现裂缝为失爆,机电运输,B
《山西省煤矿管理标准》要求新发尘肺病病例年均增长率控制在3%以内。,,,,,0,,,1815,,,2016,判断题,,2016B500,n
对重大、特别重大生产安全事故负有责任的，终身不得担任本行业生产经营单位的主要负责人。,,,,,1,1,,1693,,,2016,判断题,,2016B500,y
生产经营单位负责人接到事故现场有关人员的事故报告后，应当(        )。,,立即如实向有关部门报告,立即对事故责任人做出处理,立即采取有效措施组织抢救,1,,,2284,,在控制事故扩大后再上报有关部门,2016,多选题,立即展开事故调查,2016B500,B，D
煤矿井下(        )kW及以上的电动机，应采用真空电磁起动器控制。,,,50,40,0,,,150,,,2012,单选题,30,机电运输,B
靠近掘进工作面迎头(        )长度以内的支架，爆破前必须加固。,,,15m,10m,0,,,2253,,,2016,单选题,5m,2016B500,B
专项应急预案应当包括危险性分析、可能发生的事故特征、应急组织机构与职责、预防措施、应急处置程序和应急保障等内容。,,,,,0,,,1018,,,2012,判断题,,安全管理,y
根据《煤矿重大安全生产隐患认定办法<试行>》之规定，高瓦斯矿井、煤与瓦斯突出矿井、开采容易自燃和自燃煤层<薄煤层除外>矿井采用前进式开采的，属于煤矿重大安全生产隐患。,,,,,0,,,1634,,,2012,判断题,,法律法规,y
煤炭生产与煤矿建设的安全投入和职业病危害防治费用提取、使用必须符合国家有关规定。,,,,,0,,,2404,,,2017,判断题,,2017B500,y
依据《安全生产法》的规定，(        )是安全生产的主体。,,监理工程师,建设单位,生产经营单位,0,,,2136,,,2016,单选题,施工单位,2016B500,B
通电以后拒爆时，爆破工必须先取下把手或钥匙，并将爆破母线从电源上摘下，扭结成短路，再等一定时间[使用延期电雷管时，至少等(        )min]，才可沿线路检查，找出拒爆的原因。,,,15,10,0,,,171,,,2012,单选题,5,爆破安全,C
煤矿企业每年雨季前必须对防治水工作进行全面检查。,,,,,0,,,1038,,,2012,判断题,,地质安全,y
井下爆破工作必须由专职爆破工或现场班<组>长担任。,,,,,0,,,1310,,,2012,判断题,,爆破安全,n
在总回风巷和专用回风巷中可以敷设电缆。,,,,,0,,,1435,,,2012,判断题,,机电运输,n
采用矿用防爆型柴油动力装置时，各部件不得用铝合金制造。（）,发动机壳体不得采用铝合金制造,,,,0,,,2481,,,2017,判断题,,2017B500,n
煤矿发生生产安全事故和事故调查处理期间，主要负责人不得(        )。,,,立即处理,组织救援,0,,,415,,,2012,单选题,擅离职守,法律法规,A
特种作业人员经有关业务主管部门考核合格，取得特种作业操作资格证书，是企业取得安全生产许可证必须具备的安全生产条件之一。,,,,,0,,,1561,,,2012,判断题,,法律法规,y
矿用电气设备的失爆主要是由于安装、检修质量不符合标准及使用、维护不当造成的。,,,,,0,,,1427,,,2012,判断题,,机电运输,y
瓦斯喷出区域和突出煤层采用局部通风机通风时，必须采用压入式。（）,,,,,0,,,2500,,,2017,判断题,,2017B500,y
工会依法组织职工参加本单位安全生产工作的(        )，维护职工在安全生产方面的合法权益。,,生产管理,民主监督,安全管理,0,,,778,,,2012,多选题,民主管理,法律法规,AC
建设项目在竣工验收前，建设单位应当进行职业病危害控制效果评价。建设项目竣工验收时，其职业病防护设施经卫生行政部门验收合格后，方可投入正式生产和使用。,,,,,0,,,1493,,,2012,判断题,,职业防护,y
永久性防火墙的管理，应不定期测定和分析防火墙内的气体成分和空气温度。,,,,,0,,,1272,,,2012,判断题,,一通三防,n
矿井井下水仓的空仓容量应当经常保持在总容量的(        )％以上。,,,50,30,0,3,,91,,,2012,单选题,10,地质安全,C
《安全生产法》规定：生产经营单位与从业人员订立协议，免除或者减轻其对从业人员因生产安全事故伤亡依法应承担的责任的，该协议无效。,,,,,0,,,1801,,,2016,判断题,,2016B500,y
矿山建设项目和用于生产、储存危险物品的建设项目，应当分别按照国家有关规定进行(        )。,,,安全条件论证和安全评价,安全管理和监督,0,,,205,,,2012,单选题,安全警示和安全管理,法律法规,C
《山西省煤矿建设施工管理标准》要求煤矿施工使用的涉及安全生产的产品，必须取得煤矿矿用产品安全标志。,,,,,0,,,1819,,,2016,判断题,,2016B500,y
(        )是水害防治工作的第一责任人。,,,安监处长,煤矿主要负责人,0,,,548,,,2012,单选题,总工程师,地质安全,B
干式抽采瓦斯泵()管路系统中，必须装设有防回火、防回流和防爆炸作用的安全装置，并定期检查，保持性能良好。,,吸气侧,出气侧,泵体,0,1,,2745,,,2017,单选题,排空侧,2017B500,D
地面瓦斯抽采泵房内电气设备、照明和其他电气仪表都应采用矿用防爆型；否则()。,,限制人员出入,配备消防设施,必须采取安全措施,0,,,2744,,,2017,单选题,严禁使用,2017B500,B
排放瓦斯过程中，必须采取的措施有(        )。,,排出的瓦斯与全风压风流混合处的瓦斯和二氧化碳浓度不超过15％,撤出回风系统内的人员,切断回风系统内的电源,0,4,,728,,,2012,多选题,局部通风机不循环风,一通三防,ABCD
下列属于供电安全作业制度的有(        )。,,停、送电制度,工作监护制度,工作许可制度,0,,,674,,,2012,多选题,工作票制度,机电运输,ABCD
矿井轨道铺设质量要求，轨道接头的间隙不得大于5mm。,,,,,0,,,1365,,,2012,判断题,,机电运输,y
根据《煤矿安全培训规定》，安全培训机构应当对参加培训人员进行安全培训，不需要审查基本条件。,,,,,0,,,1588,,,2012,判断题,,法律法规,n
综合机械化采煤工作面，在采取煤层注水和采煤机喷雾降尘等措施后，其最大风速不得超过(        )m／s。,,,6,5,0,,,160,,,2012,单选题,4,一通三防,B
爆炸产生火灾，应(        )，并应采取防止再次发生爆炸的措施。,,,先救人后灭火,先灭火后救人,0,,,441,,,2012,单选题,同时灭火和救人,应急管理,A
《煤矿重大安全生产隐患认定办法<试行>》中“使用明令禁止使用或者淘汰的设备、工艺”：是指有下列(        )情形之一。,,使用非阻燃皮带、非阻燃电缆，采区内电气设备未取得煤矿矿用产品安全标志的,矿井提升人员的绞车、钢丝绳、提升容器、斜井人车等未取得煤矿矿用产品安全标志，未按规定进行定期检验的,突出矿井在2006年1月6日之前未采取安全措施使用架线式电机车或者在此之后仍继续使用架线式电机车的,0,5,,587,,,2012,多选题,被列入国家应予淘汰的煤矿机电设备和工艺目录的产品或工艺，超过规定期限仍在使用的,法律法规,ABCD
煤矿企业必须设置专门机构负责煤矿安全生产与职业病危害防治管理工作，配备满足工作需要的人员及装备。,,,,,0,,,2403,,,2017,判断题,,2017B500,y
骨折固定的范围应包括骨折远近端的两个关节。,,,,,0,2,,1480,,,2012,判断题,,应急管理,y
连续爆炸是煤尘爆炸的特征，与有无积尘没有关系。,,,,,0,,,1203,,,2012,判断题,,一通三防,n
缓倾斜、倾斜煤层宜采用走向长壁采煤法后退式开采；当煤层倾角小于(        )且条件适宜时，可采用倾斜长壁采煤法后退式开采。,,,12°,15°,0,,,2242,,,2016,单选题,18°,2016B500,C
《安全生产法》规定的生产安全一般事故、较大事故、重大事故、特别重大事故的划分标准由(        )规定。,,人民法院,国务院,各级人民政府,0,,,2153,,,2016,单选题,国家安全监督管理部门,2016B500,C
生产和在建矿井必须制定并上、下防灭火措施.,,,,,0,,,1265,,,2012,判断题,,一通三防,y
"采掘工作面或者其他地点发现有（）等透水征兆时,应当立即停止作业,撤出所有受水患威胁地点的人员,报告矿调度室,并发出警报。在原因未查清、隐患未排除之前,不得进行任何采掘活动。",,裂隙渗水、钻孔喷水、煤壁溃水、水色发浑、有臭味?,水叫?、?顶板来压、片帮、淋水加大、底板鼓起,空气变冷、出现雾气,1,,,2813,,,2017,多选题,煤层变湿、挂红、挂汗?,2017B500,"A,B,C,D"
根据我国现行有关法律法规的规定，煤矿企业必须依法参加(        )。,,,财产保险,工伤社会保险,0,,,487,,,2012,单选题,医疗保险,法律法规,B
"煤矿企业应当落实应急管理主体责任,建立健全事故预警、应急值守、信息报告、现场处置、()管理和使用等规章制度。",,,安全避险设施,救援装备和物资储备,0,,,2765,,,2017,多选题,应急投入,2017B500,"A,B,C"
建立、健全安全生产责任制，制定完备的安全生产规章制度和操作规程，是企业取得安全生产许可证必须具备的安全生产条件之一。,,,,,0,,,1557,,,2012,判断题,,法律法规,y
最大控顶距与最小控顶距之差是(        )。,,,来压步距,排距,0,,,279,,,2012,单选题,放顶步距,开采安全,A
矿井防隔水煤<岩>柱一经确定，不得随意变动，并通报相邻矿井。,,,,,0,,,1041,,,2012,判断题,,地质安全,y
煤矿地面、井下各种电气设备和（）的设计、选型、安装等必须按本规程执行。,,,动输系统,电力系统,0,,,2697,,,2017,单选题,通信系统,2017B500,B
《山西省煤矿建设标准》要求新招收的经安全教育培训考试合格的井下作业人员，必须在有安全工作经验的职工带领下跟班实习满(        )个月后经考核合格，方可独立工作。,,8,6,4,0,,,2191,,,2016,单选题,2,2016B500,B
防治水工作应当采取防、堵、疏、排、()的综合治理措施。?,,放?,注?,探,0,,,2615,,,2017,单选题,截;,2017B500,A
安装图像监视系统的矿井，无需在矿调度室设置集中显示装置，并具有存储和查询功能。,,,,,1,,,2447,,,2017,判断题,,2017B500,n
关于搬运的原则，以下说法正确的是(        ),,一般伤员可用担架、木板等搬运,对昏迷或有窒息症状的伤员，肩要垫高，头后仰，面部偏向一侧或侧卧位，保持呼吸道畅通,呼吸、心跳骤停者，应先行复苏术，然后再搬运,0,1,,590,,,2012,多选题,必须在原地检伤,应急管理,ABCD
被责令停产整顿的煤矿擅自从事生产的，县级以上地方人民政府负责煤矿安全生产监督管理的部门、煤矿安全监察机构应当提请有关地方人民政府(        )；构成犯罪的，依法追究刑事责任。,,并处违法所得1倍以上5倍以下的罚款,没收开采出的煤炭以及采掘设备,没收违法所得,0,5,,891,,,2012,多选题,予以关闭,法律法规,ABCD
煤矿企业自接到县级以上地方人民政府负责煤矿安全生产监督管理的部门、煤矿安全监察机构下达的停产整顿指令之日起，必须立即停止生产。严禁(        )等非法生产行为。,,组织职工进行安全教育和培训,假整顿真生产,日停夜开,0,,,779,,,2012,多选题,明停暗开,法律法规,ABC
生产经营单位的安全生产管理人员的职责不包括(        )。,,及时如实报告生产安全事故,督促落实本单位安全生产整改措施,组织或者参与本单位安全生产教育和培训,1,1,,2314,,对在安全生产中存在的重大问题予以协调解决,2016,多选题,制止和纠正违章指挥强令冒险作业违反操作规程,2016B500,D，E
73煤矿企业的安全生产管理人员应当恪尽职守，依法履行职责。,,,,,0,,,1757,,,2016,判断题,,2016B500,y
井巷揭穿含水层或者地质构造带等可能突水地段前，必须编制探放水设计，并制定相应的防治水措施。（）?,,,,,0,,,2420,,,2017,判断题,,2017B500,y
溜放（）的溜道等地点中严禁敷设电缆。,,设备,材料,矸,0,,,2859,,,2017,多选题,煤,2017B500,"A,B,C"
钻孔放水前，应当估计积水量，并根据矿井排水能力和水仓容量，控制放水流量，防止淹井；放水时，应当有专人监测钻孔出水情况，测定水量和水压，做好记录。如果水量突然变化，应当书面报告矿调度室，分析原因，及时处理。,,,,,0,,,2448,,,2017,判断题,,2017B500,n
《山西省煤矿安全质量标准化标准》中通风专业标准要求井下消防管路系统每隔100m设置(        )。,,检测系统,专用支管和阀门,观测点,0,,,2196,,,2016,单选题,消防水池,2016B500,C
矿山建设项目和用于生产、储存、装卸危险物品的建设项目，应当分别按照国家有关规定进行安全安全条件论证和安全评价。,,,,,0,,,1739,,,2016,判断题,,2016B500,n
通常按矿井防尘措施的具体功能，将综合防尘技术分为(        ),,个体防护,通风除尘,降尘措施,0,6,,701,,,2012,多选题,减尘措施,一通三防,ABCD
在透水事故的抢救中，要检查防水闸门是否(        )并派专人看守，清理淤渣。,,抗拉,抗压,严密,0,1,,759,,,2012,多选题,灵活,地质安全,AB
破碎顶板容易发生局部漏顶现象，如果得不到及时支护，易发生工作面(        )冒顶事故。,,,漏冒型,推垮型,0,,,473,,,2012,单选题,压垮型,开采安全,C
井下固定敷设电缆的绝缘和外部检查，应每(        )1次。,,,年,6个月,0,,,325,,,2012,单选题,季,机电运输,A
地面瓦斯抽采泵房和泵房周围（）m范围内，禁止堆积易燃物和有明火。,,,50,30,0,,,2684,,,2017,单选题,20,2017B500,A
下列(        )点火源可点燃悬浮煤尘。,,井下火灾,摩擦火花,电器火花,0,2,,903,,,2012,多选题,炸药火焰,一通三防,ABCD
井下低压电动机的控制设备，应具备短路、过负荷、单相断线、漏电闭锁保护装置及远程控制装置。,,,,,0,,,1408,,,2012,判断题,,机电运输,y
根据《煤矿重大安全生产隐患认定办法<试行>》之规定，开采容易自燃煤层为设置采区专用回风巷的，属于煤矿重大安全生产隐患。,,,,,0,,,1628,,,2012,判断题,,法律法规,y
安全生产监督管理部门应当加强对建设单位验收活动和验收结果的监督考核。,,,,,1,,,1742,,,2016,判断题,,2016B500,y
矿山企业必须具有保障安全生产的设施，建立、健全安全管理制度，采取有效措施改善职工劳动条件，加强矿山安全管理工作，保证(        )。,,,经济效益,社会和谐,0,,,206,,,2012,单选题,安全生产,法律法规,A
倾斜井巷运输时，矿车之间的连接、矿车与钢丝绳之间的连接，必须使用不能自行脱落的连接装置，并加装保险绳。,,,,,0,,,1376,,,2012,判断题,,机电运输,y
采掘工作面的进风和回风不得经过(        )。,,应力集中区,冒顶区,采空区,0,4,,758,,,2012,多选题,裂隙区,一通三防,BC
用人单位违反职业病防治法的规定，造成重大职业病危害事故或者其他严重后果，构成犯罪的，对直接负责的主管人员和其他直接责任人员，依法(        )。,,,追究刑事责任,给予经济处罚,0,,,545,,,2012,单选题,追究民事责任,职业防护,C
煤尘顶板有含水层和水体存在时，应当观测“三带”发育高度。当导水裂隙带范围内的含水层或老积水影响安全开采时，必须(        )水，并建立疏排水系统。,,,边掘边探,边采边探,0,1,,2103,,,2016,单选题,超前探放,2016B500,A
煤矿企业为从业人员提供劳动防护用品时，可根据情况采用货币或其他物品替代。,,,,,0,,,1707,,,2016,判断题,,2016B500,n
“有严重水患，未采取有效措施”是指有下列(        )情形之一。,,擅自开采各种防隔水煤柱,在有突水威胁区域进行采掘作业未按规定进行探放水,矿井水文地质条件复杂没有配备防治水机构或人员，未按规定设置防治水设施和配备有关技术装备、仪器,0,,,855,,,2012,多选题,未查明矿井水文地质条件和采空区、相邻矿井及废弃老窑积水等情况而组织生产,法律法规,ABCD
井下爆破作业，必须使用煤矿许用炸药和毫秒延期电雷管。,,,,,0,,,1292,,,2012,判断题,,爆破安全,n
煤矿安全生产是指在煤矿生产活动过程中(        )不受到危害，物、财产不受到损失。,,,人的健康,人的生命和健康,0,,,411,,,2012,单选题,人的生命,安全管理,B
根据《煤矿重大安全生产隐患认定办法<试行>》之规定，主井、回风井同时出煤的，属于煤矿重大安全生产隐患。,,,,,0,,,1613,,,2012,判断题,,法律法规,y
在(        )情况下采用隔绝方法或综合方法灭火。,,采用直接灭火不经济时,用积极方法无效或直接灭火对人员有危险时,水源、人力、物力充足时,0,2,,796,,,2012,多选题,缺乏灭火器材或人员时,应急管理,ACD
《煤矿安全质量标准化标准》规定：采煤工作面梁端至煤壁顶板冒落高度不大于200mm，综采不大于(        )mm。,,,300,200,0,,,98,,,2012,单选题,100,开采安全,C
"井下巷道内的电缆,沿线每隔一定距离,在拐弯或分支点以及连接不同直径电缆的接线盒两端,穿墙电缆的墙的两边都应设置注有（）的标志牌,以便识别。",,截面,电压,用途,0,3,,2853,,,2017,多选题,编号,2017B500,"A,B,C,D"
煤矿作业人员可以熟悉应急救援预案和避灾路线，具有自救互救和安全避险知识。,（必须）,,,,1,,,2364,,,2017,判断题,,2017B500,n
风流中一氧化碳浓度不超过(        )％。,,,0.0024,0.00025,0,1,,10,,,2012,单选题,0.004,一通三防,C
立井提升时，可以使用有接头的钢丝绳。,,,,,0,,,1382,,,2012,判断题,,机电运输,n
煤矿企业虽然没有办理延期手续，但实际上已经主动停止了生产，则(        )受到处罚。,,,也必须,不应当,0,,,495,,,2012,单选题,应当,法律法规,B
安全检查应贯彻(        )的原则。,,检查与效益相结合,检查和整改相结合,自查和互查相结合,0,,,760,,,2012,多选题,领导与群众相结合,安全管理,ABC
经由地面架空线路引入井下的供电线路和电机车架线，必须在入井处装设防雷电装置。,,,,,0,,,1412,,,2012,判断题,,机电运输,y
矿井轨道铺设质量要求，轨道接头的间隙不得 大于 5mm。 ,,,,,0,1,,2061,,,2016,判断题,,2016B500,y
职能管理机构负责人按照本机构的职责，组织有关人员做好安全生产责任制的(        )，职能管理机构工作人员在本人职责范围内做好安全生产工作。,,,落实,审定,0,1,,526,,,2012,单选题,制定,安全管理,C
煤矿企业必须加强职业病危害的防治与管理，做好作业场所的职业卫生和劳动保护工作。采取有效措施控制尘、毒危害，保证作业场所符合国家职业卫生标准。,,,,,0,,,1513,,,2012,判断题,,职业防护,y
职业危害申报以煤矿为单位，每年申报一次，煤矿企业应于每年(        )前完成上一年度申报工作。,,,2月28日,1月31日,0,1,,157,,,2012,单选题,3月31日,法律法规,A
煤矿从业人员调整工作岗位或者离开本岗位(        )重新上岗前，应当重新接受安全培训；经培训合格后，方可上岗作业。,,,2年以上(含2年),1年以上(含1年),0,,,218,,,2012,单选题,半年以上(含半年),法律法规,B
煤矿闭坑前，煤矿企业必须编制闭坑报告，并报省级煤炭行业管理部门批准。,,,,,0,,,2392,,,2017,判断题,,2017B500,y
在煤矿井下，容易碰到的、裸露的带电体及机械外露的转动和传动部分必须加装护罩或遮栏等防护设施。,,,,,0,,,1402,,,2012,判断题,,机电运输,y
