question,note,optionD,optionC,optionB,mark,count,optionF,questionid,subject,optionE,year,type,optionA,paperName,answer
安全生产许可证有效期满需要延期的，企业应当于期满前2个月向原安全生产许可证颁发管理机关办理延期手续。,,,,,0,,,1569,,,2012,判断题,,法律法规,n
架设梯形棚，巷道侧压大时，支架的岔脚应该小些。,,,,,0,,,1122,,,2012,判断题,,开采安全,n
疑似职业病病人在诊断、医学观察期间的费用，由用人单位承担。,,,,,0,,,1494,,,2012,判断题,,职业防护,y
实现主要通风机集中监控、图像监视的主要通风机房可不设专职司机，但必须实行巡检制度。（）,,,,,0,,,2495,,,2017,判断题,,2017B500,y
开采煤炭时矿尘生成量的多少与地质因素无关。,,,,,0,,,1201,,,2012,判断题,,一通三防,n
按照《煤矿安全规程》的相关规定，I期尘肺病患者每年复查(        )次。,,,3,2,0,1,,72,,,2012,单选题,1,职业防护,A
煤矿企业必须建立()，健全规章制度，编制应急救援预案，储备应急救援物资、装备并定期检查补充。,,,山救援组织,疗救护组织,1,,,2627,,,2017,单选题,应急救援组织,2017B500,A
判断井下发生爆炸事故时是否有煤尘参与的重要标志是(        )。,,,粘焦,二氧化碳,0,,,425,,,2012,单选题,水滴,一通三防,C
探放老空积水最小超前水平钻距不得小于(        )m，止水套管长度不得小于10m。,,,4,30,0,,,92,,,2012,单选题,10,地质安全,B
在井筒内运送爆炸材料时，罐笼升降速度应遵守下列规定：运送硝化甘油类炸药或电雷管时，不得超过(        )m／s；送其他类爆炸材料时，不得超过4m／s。,,,3,2,0,,,60,,,2012,单选题,1,爆破安全,B
根据安全管理的职能，安全管理的内容包括(        )。,,对财务的管理,对组织与技术的管理,对人的管理,1,,,634,,,2012,多选题,对企业的管理,安全管理,BC
矿井内因火灾防治技术有(        )等。,,阻化剂防火,预防性灌浆,防止漏风,0,1,,683,,,2012,多选题,合理的开拓开采及通风系统,一通三防,ABCD
生产经营单位建立安全生产责任制的必要性是从(        )上落实“安全生产，人人有责”，从而增强各级管理人员的责任心，使安全管理纵向到底、横向到边，责任明确、协调配合，把安全工作落到实处。,,,制度,方法,0,,,387,,,2012,单选题,内容,安全管理,C
《煤矿安全规程》第九十四条规定：报废的平硐必须从硐口向里用泥土填实至少(        )m，再砌封墙。,,,20,15,0,2,,82,,,2012,单选题,10,开采安全,C
井下电缆应带有供保护接地用的足够截面的导体。,,,,,0,,,1403,,,2012,判断题,,机电运输,y
《煤矿安全规程》第二百六十二条规定：受水淹区积水威胁的区域，必须在排除积水、消除威胁后方可进行采掘作业；如果无法排除积水，开采倾斜、缓倾斜煤层的，必须按照《建筑物、水体、铁路及主要井-巷煤柱留设与压煤开采规程》中有关水体下开采的规定，编制专项开采设计，由(        )审批后，方可进行。,,,总工程师,煤矿企业主要负责人,0,,,416,,,2012,单选题,设计院,地质安全,B
除水采矿井和水采区外，矿井必须建立完善的防尘供水系统。没有防尘供水管路的采掘工作面不得生产。,,,,,0,,,1504,,,2012,判断题,,职业防护,y
升降物料用的钢丝绳，自悬挂时起18个月进行第一次检验，以后每隔6个月检验一次。,,,,,0,,,1343,,,2012,判断题,,机电运输,n
国务院制定《国务院关于预防煤矿生产安全事故的特别规定》的根本目的是(        ).,,保障职工的生命安全和煤矿安全生产,预防煤矿生产安全事故发生,落实煤矿安全生产责任制,0,3,,692,,,2012,多选题,及时发现并排除煤矿安全生产隐患,法律法规,ABCD
工作水泵的能力，应当能在20h内排出矿井()?h的正常涌水量（包括充填水及其他用水）。?,,48?,24;,12?,0,,,2622,,,2017,单选题,8?,2017B500,C
提升钢丝绳或制动钢丝绳的直径减小量达到(        )％时，必须更换。,,,15,10,0,,,170,,,2012,单选题,5,机电运输,B
安全资格培训应坚持(        )的原则。,,,学用分离,教学分离,0,,,338,,,2012,单选题,教考分离,法律法规,A
个体防尘要求作业人员佩戴(        )和防尘安全帽。,,,防尘耳塞,防尘口罩,0,,,271,,,2012,单选题,防尘眼镜,职业防护,B
《安全生产法》规定，关于从业人员的安全生产义务，下列说法中，正确的是(        )。,,发现事故隐患或者其他不安全因素及时报告的义务,接受安全培训，掌握安全生产技能的义务,正确佩戴和使用劳动防护用品的义务,0,3,,2279,,发现事故隐患或者其他不安全因素及时消除的义务,2016,多选题,遵章守规服从管理的义务,2016B500,A，B，C，D
根据《煤矿重大安全生产隐患认定办法<试行>》之规定，被例入国家应予淘汰的煤矿机电设备和工艺目录的产品或工艺，超过规定期限仍在使用的，属于煤矿重大安全生产隐患。,,,,,0,,,1629,,,2012,判断题,,法律法规,y
用架空乘人装置运送人员时，蹬座中心至巷道一侧的距离不得小于（）。,,,0.7,0.6,0,,,2668,,,2017,单选题,0.5,2017B500,C
井筒施工以及开拓新水平的井巷第一次接近各开采煤层时，必须按掘进工作面距煤层的准确位置，在距煤层垂距10m以外开始打探煤钻孔，钻孔超前工作面的距离不得小于()，并有专职瓦斯检查工经常检查瓦斯。岩巷掘进遇到煤线或接近地质破坏带时，必须有专职瓦斯检查工经常检查瓦斯，发现瓦斯大量增加或其他异常时，必须停止掘进，撤出人员，进行处理。,,6m,5m,3m,0,,,2728,,,2017,单选题,2m,2017B500,C
设立矿山企业，必须符合国家规定的资质条件，并依照法律和国家有关规定，由审批机关对其矿区范围、矿山设计或者(        )和环境保护措施等进行审查；审查合格的，方予批准。,,安全措施,地质报告,生产技术条件,0,,,734,,,2012,多选题,开采方案,法律法规,ABD
煤矿尘肺因吸人矿尘成分的不同分为(        ).,,岩肺,煤肺,煤矽肺,0,,,867,,,2012,多选题,矽肺,职业防护,ABC
采煤工作面的正规循环率是按(        )计算的。,,,季,月,0,,,2241,,,2016,单选题,日,2016B500,B
工作面转载机安有破碎机时，必须有()装置。,,安全防护,自移,防过卷,0,,,2604,,,2017,单选题,防崩,2017B500,D
在高瓦斯矿井和有煤<岩>与瓦斯突出危险的采掘工作面的实体煤中，为增加煤体裂隙、松动煤体而进行的(        )m以上的深孔预裂控制爆破，可使用二级煤矿许用炸药，但必须制定安全措施。,,,10,8,0,,,178,,,2012,单选题,5,爆破安全,C
《煤矿安全规程》第五十条规定：采煤工作面与巷道连接处超前压力影响范围内必须加强支护，且加强支护的巷道长度不得小于(        )。,,,30,20,0,,,83,,,2012,单选题,10,开采安全,B
冒顶区的正常通风如一时不能恢复，则必须利用(        )向埋压或截堵的人员供给新鲜空气。,,打钻,水管,巷道,1,5,,879,,,2012,多选题,压风管,开采安全,ACD
紧急避险设施的布局、类型、技术性能等具体设计，应当经（）审批。,,分管矿长,安监处长,矿长,1,1,,2576,,,2017,单选题,矿总工程师,2017B500,A
区<队>安全管理的内容主要包括(        ),,日常事务管理工作,安全信息化工作,生产建设中的动态安全管理,0,2,,574,,,2012,多选题,安全管理的基础工作,安全管理,ABC
厂房、作业场所和安全设施、设备、工艺符合有关安全生产法律、法规、标准和规程的要求，是企业取得安全生产许可证必须具备的安全生产条件之一。,,,,,0,,,1564,,,2012,判断题,,法律法规,y
巷道运输时，电机车司机离开座位时，必须(        )。,,关闭车灯,扳紧车闸,取下控制手把,0,,,791,,,2012,多选题,切断电动机电源,机电运输,ABC
倾斜井巷串车提升时，必须设置的安全装置有(        )。,,斜巷防跑车装置,，各车场甩车时能发出警号的信号装置,挡车栏,0,,,929,,,2012,多选题,阻车器,机电运输,ABCD
煤矿企业、矿井应当定期收集、调查和核对相邻煤矿和废弃的老窑情况。,,,,,0,,,1035,,,2012,判断题,,地质安全,y
根据《煤矿重大安全生产隐患认定办法<试行>》之规定，擅自开采保安煤柱的，属于煤矿重大安全生产隐患。,,,,,0,1,,1623,,,2012,判断题,,法律法规,y
《煤矿安全规程》第七十五条规定：高瓦斯区域(        )掘进工作面，严禁使用钢丝绳牵引的耙装机。,,,煤巷,岩巷,0,,,217,,,2012,单选题,半煤岩巷,开采安全,C
低瓦斯矿井的主要回风巷、采区进（回）风巷可以使用非防爆机车。（）,不得使用,,,,0,,,2480,,,2017,判断题,,2017B500,n
抽采瓦斯泵及其附属设备，至少应当有1套备用，备用泵能力不得小于运行泵中最小一台单泵的能力。,最大一台单泵的能力,,,,0,,,2501,,,2017,判断题,,2017B500,n
煤炭生产应当依法在批准的开采范围内进行，不得超越批准的开采(        )越界、越层开采。,,,煤层,煤种,1,,,269,,,2012,单选题,范围,法律法规,A
下列设备中，不能使用有接头的钢丝绳的是(        )。,,,30°以上倾斜井巷中专为升降物料的绞车,斜巷钢丝绳牵引带式输送机,0,,,393,,,2012,单选题,平巷运输设备,机电运输,C
在掘进工作面中，煤层占(        )以上称为煤巷。,,,4／5,2／3,0,,,79,,,2012,单选题,1／2,开采安全,C
生产经营单位的安全生产规章制度所约束的对象是(        )。,,,，所有从业人员,，主要负责人,0,1,,299,,,2012,单选题,管理人员,安全管理,C
煤矿井下照明、信号、电话和手持式电气设备的供电额定电压，不得超过(        )V。,,,36,127,0,,,131,,,2012,单选题,220,机电运输,B
人员分站安装前应在地面上编码通电检查和测试，确认无误后方可下井安装。,,,,,0,,,2516,,,2017,判断题,,2017B500,y
在煤层开采中，下列(        )种顶板管理方式瓦斯涌出量大。,,,全部垮落法,弯曲下沉法,0,3,,240,,,2012,单选题,充填法,一通三防,C
安全生产监督检查人员应当将检查的(        )作出书面记录，并由检查人员和被检查单位的负责人签字。,,周边环境,现场人数,发现的问题及其处理情况,0,,,2268,,"  ",2016,多选题,时间、地点、内容,2016B500,A，B
巷道围岩的稳定性越好，承受的支承应力越小。,,,,,0,,,1115,,,2012,判断题,,开采安全,n
震动放炮要求(        )次全断面揭穿或揭开煤层。,,,3,2,1,,,53,,,2012,单选题,1,一通三防,A
《国务院办公厅关于进一步加强煤矿安全生产工作的意见》[国办发〔2013〕99号]要求规范煤矿劳动用工管理，其规定的“五个统一”内容包括统一组织报名和资格审查、统一考核和(        )。,,统一依法使用劳务派遣用工,统一参加社会保险,统一签订劳动合同和办理用工备案,0,,,2337,,"  ",2016,多选题,统一健康检查,2016B500,B，C，D
以下属于危险、有害因素辨识与分析工作内容的是(        )。,,,提出消除或减弱危险、有害因素的技术建议,划分评价单元，选择合理的评价方法,0,,,407,,,2012,单选题,确定危险因素的种类和存在的部位,安全管理,A
一个采煤工作面的绝对瓦斯涌出量大于(        )m?决瓦斯问题不合理的，必须建立抽放系统。,,,5,3,0,,,120,,,2012,单选题,2,一通三防,C
煤矿领导升井后，应当及时将下井的时间、地点、经过路线、发现的问题及处理情况、意见等有关情况进行登记，并由专人负责整理和存档备查。,,,,,0,,,1678,,,2012,判断题,,法律法规,y
突出矿井，以及发生险情或者事故时井下人员依靠自救器或者（）自救器接力不能安全撤至地面的矿井，应当建设井下紧急避险设施。,,4次,3次,2次,1,2,,2575,,,2017,单选题,1次,2017B500,A
开采容易自燃和自燃的煤层时，采煤工作面可以采用前进式或后退式开采，并根据采取防火措施后的煤层自然发火期确定采区开采期限.,,,,,0,,,1278,,,2012,判断题,,一通三防,n
10kV及其以下的矿井架空电源线路不得共杆架设。,,,,,0,,,1399,,,2012,判断题,,机电运输,y
煤矿企业已经按规定配发给从业人员劳动防护用品，从业人员在劳动过程中是否佩带、使用由自己决定。,,,,,0,,,1508,,,2012,判断题,,职业防护,n
采掘工作面风流中二氧化碳浓度达到()时，必须停止工作，撤出人员，查明原因，制定措施，进行处理。,,0.80%,1.00%,1.50%,1,,,2719,,,2017,单选题,2%,2017B500,B
"班组长应当具备兼职救护队员的知识和能力,能够在发生险情后第一时间组织作业人员（）和安全避险。",,,急救,互救,0,,,2770,,,2017,多选题,自救,2017B500,"A,B"
煤矿企业应当落实应急管理主体责任，建立健全事故预警、应急值守、信息报告、现场处置、应急投入、救援装备和物资储备、（）管理和使用等规章制度。,,安全避险设施,安全设施,应急设施,1,1,,2564,,,2017,单选题,应急物资,2017B500,D
在倾斜井巷中使用有接头的钢丝绳时，其插接长度不得小于钢丝绳捻距的5倍。,,,,,0,,,1383,,,2012,判断题,,机电运输,n
装有带式输送机的井筒兼作回风井时，井筒中的风速不得超过(        )m／s。,,,6,5,0,,,161,,,2012,单选题,4,一通三防,C
煤矿井下生产中，下列(        )项可能引起煤尘爆炸事故。,,煤仓中放浮炮处理堵仓,在有积尘的地方放明炮,在煤尘中放连珠炮,0,1,,818,,,2012,多选题,使用非煤矿安全炸药爆破,一通三防,ABCD
井下爆炸材料库房距井筒、井底车场、主要运输巷道、主要硐室以及影响全矿井或大部分采区通风的风门的法线距离：硐室式的不得小于(        )m，壁槽式的不得小于60m。,,,120,100,0,,,192,,,2012,单选题,80,爆破安全,B
《强化煤矿瓦斯防治十条规定》[国家安全生产监督管理总局令第82号]：必须严格矿井瓦斯等级鉴定，(        )对鉴定资料的真实性负责，鉴定单位对鉴定结果负责。,,,施工单位,煤矿,0,,,2169,,,2016,单选题,鉴定单位,2016B500,B
煤矿作业人员必须熟悉应急救援预案和避灾路线，具有（）和安全避险知识。,,急救,互救,自救,1,,,2570,,,2017,单选题,自救互救,2017B500,A
井下检修或搬迁电气设备前，通常作业程序包括(        ),,放电,。验电,瓦斯检查,0,,,835,,,2012,多选题,停电,机电运输,ABCD
《安全生产法》不仅适用于生产经营单位，同时也适用于国家安全和社会治安方面的管理。,,,,,0,,,1700,,,2016,判断题,,2016B500,n
下列措施能隔绝煤尘爆炸的有(        ),,,设置水棚,撒布岩粉,0,1,,795,,,2012,多选题,清除落尘,一通三防,BC
依据《安全生产法》，煤矿企业的主要负责人对本单位安全生产工作应当履行的职责包括(        )。,,督促检查本单位的安全生产工作，及时消除生产安全事故隐患,负责一线安全生产管理，督促检查从业人员遵守安全生产规章制度和操作规程,保证本单位安全生产投入的有效实施,0,1,,2271,,组织制定并实施本单位的生产安全事故应急救援预案,2016,多选题,组织制定本单位安全生产规章制度和操作规程,2016B500,A，B，D，E
《安全生产法》规定：生产经营单位的主要负责人对重大、特别重大生产安全事故负有责任的，终身不得担任本行业生产经营单位的主要负责人。,,,,,0,,,1804,,,2016,判断题,,2016B500,y
《山西省煤矿安全质量标准化标准及考核评级办法》要求对在年度内累计死亡5人及以上的煤矿，取消当年的考核评级资格。,,,,,0,,,1827,,,2016,判断题,,2016B500,n
用人单位购买的劳动防护用品必须具有生产许可证编号、产品合格证和安全鉴定证，购买的防护用品须经本单位(        )部门验收。,,,安全生产技术,劳资,0,,,528,,,2012,单选题,质检,安全管理,C
《安全生产法》规定，生产经营单位对安全生产监督检查人员的安全检查，应当予以配合，不得拒绝、阻挠。,,,,,0,,,1785,,,2016,判断题,,2016B500,y
煤矿安全生产管理，要坚持的“三并重”原则，“三并重”包括(        )。,,培训,装备,管理,0,3,,812,,,2012,多选题,生产,法律法规,BCD
使用耙岩机时，耙岩机作业时必须有照明且耙装机绞车的刹车装置必须完整可靠。,,,,,0,,,2532,,,2017,判断题,,2017B500,y
当氧含量低于(        )％时，煤尘就不再爆炸。,,,17,20,0,3,,129,,,2012,单选题,21,一通三防,C
煤矿企业对检查出的职业病患者，必须按国家规定及时给以治疗、疗养和调离有害作业岗位，并做好健康监护及职业病报告工作。,,,,,0,,,1511,,,2012,判断题,,职业防护,y
根据《煤矿重大安全生产隐患认定办法<试行>》之规定，矿井总风量不足的，属于煤矿重大安全生产隐患。,,,,,0,6,,1612,,,2012,判断题,,法律法规,y
用人单位应教育从业人员，按照劳动保护用品的使用规则和防护要求正确使用劳动保护用品，使职工做到(        )。,,会掌握检验维修劳动保护用品的知识,会正确维护保养劳动保护用品,会正确使用劳动保护用品,0,,,686,,,2012,多选题,会检查劳动保护用品的可靠性,安全管理,ABC
《煤矿安全规程》规定：采煤工作面必须及时回柱放顶或充填，(        )超过作业规程规定时，禁止采煤。,,,工作面长度,推移步距,0,,,359,,,2012,单选题,控顶距离,开采安全,A
《山西省煤矿建设标准》要求煤矿建设项目进行联合试运转的期限一般为1～6个月，超过批准期限的可以申请延期，但延期最长不得超过(        )个月。,,5,4,3,0,,,2192,,,2016,单选题,2,2016B500,B
井下排水系统中的(        )和配电设备及输电线路，必须经常检查和维护，每年雨季前必须全面检修一次。,,水泵,闸阀,水管,0,,,825,,,2012,多选题,水仓,地质安全,BCD
《煤矿领导带班下井及安全监督检查规定》规定：煤矿是落实领导带班下井制度的责任主体，每班必须有(        )带班下井。,,,矿领导,区队负责人,0,2,,197,,,2012,单选题,安监人员,法律法规,C
《国务院关于预防煤矿安全生产事故的特别规定》规定：发现煤矿企业未按照国家有关规定对井下作业人员进行安全生产教育和培训或者特种作业人员无证上岗的，应当责令限期整改，处10万元以上50万元以下的罚款；逾期未整改的，责令停产整顿。,,,,,0,1,,1585,,,2012,判断题,,法律法规,y
在（）中不应敷设电缆。,,,总进风巷,专用回风巷,0,2,,2852,,,2017,多选题,总回风巷,2017B500,"A,B"
《山西省煤矿现代化矿井标准》要求采煤工作面设备选型应坚持技术先进、性能可靠等有利于矿井综合自动化的原则，采煤机应选用(        )，具有手动和无线遥控等功能。,,单滚筒无链液压牵引,单滚筒液压电牵引,双滚筒无链电牵引,0,,,2213,,,2016,单选题,单滚筒无链电牵引,2016B500,B
《煤矿安全规程》规定，主要排水泵房至少有2个出口，一个出口用斜巷通到井筒，并应高出泵房底板（）m以上。,,,8,7,0,,,2687,,,2017,单选题,6,2017B500,B
取得安全生产许可证的企业必须接受依法进行的监督检查，并提供相应的便利条件，积极予以配合，这是企业的一项(        )。,,,法定权力,法定义务,0,,,266,,,2012,单选题,法定权利,法律法规,B
临时停工的掘进工作面，如果停风，应(        )并向矿调度室报告。,,禁止人员进入,揭示警标,设置栅栏,0,7,,792,,,2012,多选题,切断电源,一通三防,ABCD
井下电气设备的检查、维护和调整，必须由采区电钳工进行。,,,,,0,,,1425,,,2012,判断题,,机电运输,n
我国煤矿主要采取以风、水为主的综合防尘技术措施。,,,,,0,,,1206,,,2012,判断题,,一通三防,y
“三同时”是生产经营单位安全生产的(        )措施，是一种事前保障措施。,,,安全生产,安全管理,0,,,531,,,2012,单选题,重要保障,安全管理,A
矿山建设工程安全设施竣工后，不符合矿山安全规程和(        )的，不得验收，不得投入生产。,,,地方标准,国家标准,0,,,308,,,2012,单选题,行业技术规范,法律法规,A
超能力、超强度或者超定员组织生产”是指有下列（）情形之一。,,煤矿企业未制定井下劳动定员或者实际入井人数超过规定人数,未按规定制定主要采掘设备、提升运输设备检修计划或者未按计划检修,矿井月产量超过当月产量计划10%,0,,,2795,,,2017,多选题,矿井全年产量超过矿井核定生产能力,2017B500,"A,B,C,D"
《山西省煤矿建设标准》要求井工矿在近水平多煤层开采时，当煤层层间距不大时，宜采用(        )开拓。,,,多井筒分区域,单一水平,0,,,2184,,,2016,单选题,多水平,2016B500,B
煤矿企业的从业人员有权对本单位的安全生产工作提出建议。,,,,,0,,,1762,,,2016,判断题,,2016B500,y
采掘工作面遇到下列情况之一时，必须确定探水线进行探水。(        ),,接近水文地质条件不清的区域,接近有出水可能的钻孔,接近导水断层,0,,,716,,,2012,多选题,接近水淹的井巷,地质安全,ABCD
对使用中的斜井人车防坠器，应每天进行一次 手动落闸试验。,错误原因：每天，正确为：每班,,,,0,,,2060,,,2016,判断题,,2016B500,n
巷道内轨道运输坡度大于7‰时，严禁使用人力推车。,,,,,0,,,1347,,,2012,判断题,,机电运输,y
使用刮板输送机运送物料时，必须有防止顶人和顶倒支架的安全措施。移动刮板输送机时必须有防止冒顶、顶伤人员和损坏设备的安全措施。,,,,,0,,,2559,,,2017,判断题,,2017B500,y
生产经营场所和员工宿舍应当设有符合紧急疏散要求、标志明显、保持畅通的出口，禁止锁闭、封堵生产经营场所或者员工宿舍的出口。,,,,,0,,,1775,,,2016,判断题,,2016B500,y
生产经营单位应当投保安全生产责任保险。,,,,,0,,,1690,,,2016,判断题,,2016B500,y
煤矿应当加强粉尘的监测和防治工作，制定职业危害防治措施。,,,,,0,,,1497,,,2012,判断题,,职业防护,y
生产安全事故的责任人未依法承担赔偿责任，经人民法院依法采取执行措施后，仍不能对受害人给予足额赔偿的，应当继续履行赔偿义务；受害人发现责任人有其他财产的，可以(        )请求人民法院执行。,,,在6个月内,在3个月内,0,,,429,,,2012,单选题,随时,法律法规,A
接近顶部采空区或冲积层开采工作面压力明显增大，顶板来压、片帮，局部冒顶或冒顶次数增加，有淋水或水中有砂，应考虑有溃水、溃砂的可能。,,,,,0,,,1075,,,2012,判断题,,地质安全,y
安全管理的主要目的是保护国家矿产资源，使本企业的财产、生产设备免遭损失。,,,,,0,,,946,,,2012,判断题,,安全管理,n
有线调度通信系统的调度电话至调度交换机(含安全栅)必须采用矿用通信电缆直接连接，严禁利用大地作回路。严禁调度电话由井下就地供电，或者经有源中继器接调度交换机。调度电话至调度交换机的无中继器通信距离应当不小于10km。,,,,,1,,,2452,,,2017,判断题,,2017B500,y
巷道坡度越大，支架的迎山角应当越大。,,,,,0,,,1123,,,2012,判断题,,开采安全,y
粉尘中游离二氧化硅导致肺组织纤维化，最终导致尘肺病。,,,,,0,,,1516,,,2012,判断题,,职业防护,y
井下电气设备保护接地的主接地极应用耐腐蚀的钢板制成，其面积不得小于(        )m2.厚度不得小于5mm。,,,0.8,0.75,1,,,2074,,,2016,单选题,0.5,2016B500,B
设计能力在1.2 Mt/a及以上的矿井，原则上可以布置“一井两面”。,改正：设计能力在3.0Mt/a及以上的矿井，原则上可以布置“一井两面”。,,,,0,,,1851,,,2016,判断题,,2016B500,n
《国务院办公厅关于进一步加强煤矿安全生产工作的意见》[国办发〔2013〕99号]要求大力推进煤矿安全质量标准化和自动化、信息化建设。煤矿必须确保安全监控、人员定位、(        )系统正常运转。,,,紧急避险,安全保障,0,,,2177,,,2016,单选题,通信联络,2016B500,A
煤层顶板有含水层和水体存在时，应当观测“三带”发育高度。当导水裂隙带范围内的含水层或老空积水影响安全开采时，必须(        )水，并建立疏排水系统。,,,边掘边探,边采边探,0,,,238,,,2012,单选题,超前探放,地质安全,A
《山西省煤矿现代化矿井标准》要求煤与瓦斯突出煤层严禁采用(        )工艺。,,非正规开采,水力开采,大采高开采,0,2,,2340,,"  ",2016,多选题,放顶煤开采,2016B500,A，C，D
必须根据矿井各个生产环节、煤层地质条件、厚度、()、瓦斯涌出量、自然发火倾向和矿山压力等因素，编制工作面设计。,,倾向,倾角,煤质,0,,,2613,,,2017,单选题,煤种,2017B500,C
《山西省煤矿现代化矿井标准》要求矿井应建立信息化系统，其包括(        )等。,,专家决策系统,通信联络系统,计算机管理信息系统,1,1,,2341,,"  ",2016,多选题,综合自动化系统,2016B500,A，B，C
